<Payload xmlns="http://javaops.ru"
         xmlns:xsi="http://www.w3.org/2001/XMLSchema-instance"
         xsi:schemaLocation="http://javaops.ru payload.xsd">
    <Users>
        <User flag="active" city="kiv">
            <email>gmail@gmail.com</email>
            <fullName>Full Name</fullName>
            <groups>
                <group>tj01</group>
                <group>mj01</group>
            </groups>
        </User>
        <User flag="superuser" city="spb">
            <email>admin@javaops.ru</email>
            <fullName>Admin</fullName>
        </User>
        <User flag="deleted" city="spb">
            <email>mail@yandex.ru</email>
            <fullName>Deleted</fullName>
        </User>
    </Users>
    <Cities>
        <City id="spb">Санкт-Петербург</City>
        <City id="kiv">Киев</City>
        <City id="mnsk">Минск</City>
    </Cities>
    <Projects>
        <Project id="tj">topjava</Project>
        <Project id="mj">masterjava</Project>
    </Projects>
    <Groups>
        <Group id="tj01" project="tj" condition="finished">topjava-01</Group>
        <Group id="tj02" project="tj" condition="current">topjava-02</Group>
        <Group id="mj01" project="mj" condition="current">masterjava-01</Group>
        <Group id="mj02" project="mj" condition="registering">masterjava-02</Group>
    </Groups>
</Payload>